"16:54","Ældreministeren (Thyra Frank):","Jeg er glad for, at der bl.a. også i vores nationale demenshandlingsplan er blevet afsat penge til et kompetenceløft, og jeg er overbevist om, at vi nok skal sørge for, at der er kvalificeret sygeplejepersonale til de her steder. Så det er jeg helt tryg ved. LINEBREAK ","46","20161M069_2017-03-15_1300","ORIGINAL","863""16:54","Ældreministeren (Thyra Frank):","Jeg er glad for, at der bl.a. også i vores nationale demenshandlingsplan er blevet afsat penge til et kompetenceløft, og jeg er overbevist om, at de nok skal sørge for, at der er kvalificeret sygeplejepersonale til de her steder. Så det er jeg helt tryg ved. LINEBREAK ","46","20161M069_2017-03-15_1300","PRONOUN-P-P","863"
"16:24","Ældreministeren (Thyra Frank):","Jamen tilsynets input er uvurderlige for et plejehjem, og friske øjne ser objektivt på alt det, som er dagligdag for de ansatte og borgerne. Jeg skulle selvfølgelig have sørget for, at de ting, tilsynet påpegede, blev rettet med det samme. Og det beklager jeg jeg ikke gjorde. LINEBREAK ","47","20161M065_2017-03-01_1300","ORIGINAL","779""16:24","Ældreministeren (Thyra Frank):","Jamen deres input er uvurderlige for et plejehjem, og friske øjne ser objektivt på alt det, som er dagligdag for de ansatte og borgerne. Jeg skulle selvfølgelig have sørget for, at de ting, tilsynet påpegede, blev rettet med det samme. Og det beklager jeg jeg ikke gjorde. LINEBREAK ","47","20161M065_2017-03-01_1300","PRONOUN-NP-P","779"
"17:19","Torsten Gejl (ALT):","En af de ideer, som vi hørte fra fru Karina Adsbøl, var det her med en mere kraftfuld og obligatorisk taskforce. Det havde jeg ikke selv set, det havde jeg ikke hørt før, men ideen synes jeg er god. Det er sådan noget, vi gerne vil være med til at drøfte i den forbindelse. LINEBREAK ","54","20161M044_2017-01-17_1300","ORIGINAL","519"
"20:33","Torsten Gejl (ALT):","Tak. Og tak for talen. Formålet med lovændringen var at bekæmpe utryghedsskabende tiggeri, defineret som tiggeri de nævnte steder, mens baggrunden tilsyneladende var at skræmme udenlandske hjemløse fra at rejse til Danmark og tigge. Det har siden vist sig, at ganske almindelige hjemløse, som tigger uden at skabe utryghed, også bliver ramt af lovgivningen. Hvad siger ministeren til det? LINEBREAK ","59","20181M083_2019-04-09_1300","ORIGINAL","3171"
"15:28","Finn Sørensen (EL):","Det kan jeg overhovedet ikke se. Det er jo en anden form for lovgivning, der gør det svært for danske statsborgere, der har været væk i lang tid, at komme tilbage. Det er en anden lovgivning, som Venstres ordfører selv er medansvarlig for, så det har da ikke noget med det her at gøre. LINEBREAK ","54","20161M088_2017-04-27_1002","ORIGINAL","1099"
