"10:27","Holger K. Nielsen (SF):","Jeg mener ikke, at Israel er medlem af Europarådet, i hvert fald ikke så vidt jeg ved. De er med i UEFA og i Melodi Grand Prix, det er rigtigt, og jeg skal ikke gøre mig klog på, hvorfor de er med der. Men Israel er ikke et europæisk land. LINEBREAK ","50"
"10:34","Christian Rabjerg Madsen (S):","Jeg synes, at det er et meget relevant spørgsmål, og jeg er meget enig med spørgeren. Vi vil gerne drøfte, om der kan tages initiativer i EU eller Danmark, som betyder, at vi bidrager til, at danske skibe og europæiske skibe ophugges under forsvarlige vilkår. Det vil jeg meget gerne diskutere, når vi når til udvalgsbehandlingen. LINEBREAK ","56"
"10:43","Erling Bonnesen (V):","Som det også fremgår både af ordførertalen og af det, som ligger som baggrundsmateriale, er det vigtigt, at det bliver en global, international aftale. Men hvis der kunne laves, om jeg så må sige, påvirkninger for at få flere lande til at tiltræde hurtigere, ville det kun være godt. Det er jo sådan set også det, der ligger i det. LINEBREAK ","60"
"11:07","Pia Olsen Dyhr (SF):","Jamen altså, Danmark har jo tilsluttet sig EU's skibsophugningsregler, og i dem står der meget klart, at man, som det er nu,  ikke kan ophugge på strande, eftersom faciliteterne jo ikke er på EU's liste. Derfor vil jeg bare gerne have ministeren til at bekræfte, at en dansk minister ikke arbejder for at få inkluderet strande på EU's liste. LINEBREAK ","59"
"11:10","Christian Rabjerg Madsen (S):","Jeg tror måske, ministeren kan komme det lidt nærmere, hvis ministeren anstrenger sig. Hvad er ministerens holdning til, at virksomheder udflager skibe lige inden ophugning og på den måde omgår de regler, som ministeren taler varmt for fra Folketingets talerstol, hvis rederier omgår Hongkongkonventionen, eller hvis rederier ved udflagning omgår de europæiske regler på området? Er det i orden? LINEBREAK ","59"
"11:48","Erling Bonnesen (V):","Når man lytter til ordførerens tale for Enhedslisten, lyder det jo, som om Enhedslisten sådan af princip bare er imod havdambrug. Det kan jo så være en holdning at have, men kan vi så ikke lige så godt bare få det på bordet? Kan vi få bekræftet, at Enhedslisten af princip er imod havdambrug? LINEBREAK ","54"
"15:52","Nick Hækkerup (S):","Tak for de bemærkninger – også for bemærkningerne om gennemslagskraften i det, som vi kan gøre, på trods af at vi er et lille land. Vil gennemslagskraften af det, som vi vedtager i Folketinget, efter ordførerens opfattelse være størst, hvis det er et enigt Folketing, der vedtager det, eller hvis det er et flertal i Folketinget, der vedtager det? LINEBREAK ","59"
