"14:41","Trine Torp (SF):","Det er fuldstændig korrekt, men man har ingen klagemuligheder, hvad angår indholdet af projektet. Det vil jo sige, at det godt kan være, at man varetager den borgers interesser, som gerne vil have lavet kystbeskyttelse, men alle de andre borgere, som bliver berørt af det, eller naturorganisationer osv., har ikke den samme mulighed for fuld prøvelse i de her sager. LINEBREAK ","60"
"14:48","Lisbeth Bech Poulsen (SF):","Tak. Fra SF's side ønsker vi det tilbage i udvalg. Der er kommet fire svar i dag, og det er lidt sent i forhold til at sikre en ordentlig behandling, og det har jeg også forstået at ministeren er positivt indstillet over for. LINEBREAK ","43"
"15:11","Marcus Knuth (V):","Jeg bygger min påstand på, at vi kan se, at der er mange, der melder sig til, som ikke dukker op, og så på sund logik i, at hvis folk selv har en del af betalingen, har de nok en lidt større interesse i ikke bare at blive væk på må og få. LINEBREAK ","53"
"15:14","Marcus Knuth (V):","Jamen som jeg har sagt, er det helt centrale for mig, at der stadig væk er adgang til gratis danskundervisning for herboende grønlændere og færinger, og det er der fremover. Dermed er hele den her problemstilling, altså om man fremover skal betale, ganske enkelt ikke rigtig. Der er adgang til gratis danskundervisning gennem f.eks. den forberedende voksenuddannelse. LINEBREAK ","57"
"17:30","Mattias Tesfaye (S):","Jamen det tolker jeg egentlig som en støtte til selve princippet om et beskæftigelseskrav. Så kunne jeg godt tænke mig at spørge: Ønsker Det Radikale Venstre egentlig at afskaffe integrationsydelsen og dermed sikre, at nyankomne flygtninge og familiesammenførte ville skulle på kontanthjælp, hvis ikke de har et arbejde? LINEBREAK ","48"
"17:31","Martin Henriksen (DF):","Tak for det. Fru Sofie Carsten Nielsen sagde i sin tale, at de ikke kunne støtte forslaget, fordi det handlede om hudfarve og etnicitet. Så vil jeg bare høre, om fru Sofie Carsten Nielsen kan henvise til et sted i lovforslaget, hvor hudfarve eksempelvis står nævnt. LINEBREAK ","46"
"17:41","Udlændinge- og integrationsministeren (Inger Støjberg):","Vores udgangspunkt er, at flygtninge skal arbejde og de skal forsørge sig selv, mens de er i Danmark. Men det ændrer jo så ikke på, at når forholdene i flygtningenes hjemlande tillader det, skal de selvfølgelig rejse hjem igen, og det skal de, fordi de skal genopbygge deres land. LINEBREAK ","49"
"18:35","Udlændinge- og integrationsministeren (Inger Støjberg):","I så fald må man da i hvert fald sige, at den kulturelle udveksling har virket fuldstændig, for så er det da også, fordi de har kendskab til det danske system, og fordi der rent faktisk er steder, man kan gå hen og få hjælp. LINEBREAK ","45"
"19:29","Lisbeth Bech Poulsen (SF):","Tak, så stiller jeg det skriftligt, måske sammen med et tillægsspørgsmål om, om der kan have været tilfælde, hvor man simpelt hen fra SKATs side ikke har opdaget det, eller om det her har været sådan en lidt ekstrem case, fordi de, som ministeren siger, har været meget kreative med det. Men jeg stiller spørgsmålet skriftligt. LINEBREAK ","56"
