"12:21","Trine Bramsen (S):","Jeg vil bare lige høre ordføreren, om det ikke er korrekt, at politiet fortsat har mulighed for at bruge gps, men at forskellen bare er, at de skal forbi en dommer, der skal bevidne, at de har hjemmel til at bruge den her gps – altså så de i fremtiden også vil have mulighed for at bruge gps-sporing. LINEBREAK ","58"
"12:43","Energi-, forsynings- og klimaministeren (Lars Christian Lilleholt):","Jamen altså, hvad angår Enhedslisten, er det vel ikke så uventet, at de ønsker at køre friløb. Jeg må bare sige, at når man indgår aftaler, har jeg lært, at en god forligsskik er, at man også lever op til aftalerne. LINEBREAK ","41"
"14:37","Trine Bramsen (S):","Jeg synes faktisk, det er god praksis, at man vil have boret ud, hvad et forslag i bund og grund handler om. Og jeg tænker, at hr. Marcus Knuth har set for få Olsen-banden-film, hvis han ikke ved, at der ved nogle af de her jagtselskaber bliver afgivet salutter. LINEBREAK ","49"
"14:50","René Gade (ALT):","Vi har været omkring meget i Alternativet og har haft mange gode forslag. Vi har også fremlagt et regeringsprogram, der er meget omfattende. Vi har ikke endnu har haft salatkanoner med, så jeg tager det med. Jeg ikke ordfører for det – jeg ved faktisk ikke, hvilket område det ville være under,  men jeg tager det med. Tak for ideen. LINEBREAK ","60"
"15:03","Marcus Knuth (V):","Jeg er godt klar over, at måden – også grundet kulturforskelle – man ser på straf på er anderledes i dele af Grønland. Og det er jo rigtig, rigtig fint. Så at have en dialog om udviklingen af det her vil jeg umiddelbart udelukkende se som noget positivt. LINEBREAK ","48"
"15:19","Aaja Chemnitz Larsen (IA):","Mange tak. Og også tak for ordene. Som jeg nævnte i mine spørgsmål til nogle af ordførerne, og som jeg var inde på i ordførerindlægget, mener jeg, det er rigtig vigtigt at få en demokratisk diskussion omkring de her sanktionsrammer, og det spørgsmål vil jeg også gerne stille til justitsministeren: Er det noget, som regeringen er åben over for? LINEBREAK ","59"
