"13:04","Udenrigsministeren (Anders Samuelsen):","Jeg bliver bare nødt til at understrege, at fængslingssager håndteres konsulært af Udenrigsministeriets Borgerservice, og det gør de i et tæt samarbejde med repræsentationerne. Det indebærer bl.a., at sagernes gang følges i samarbejde med fængsledes forsvarsadvokat, og i den forbindelse vurderes behovet løbende for at signalere vores forventning om en fair retsproces på relevante niveauer. Og det gør vi løbende. LINEBREAK ","60"
"13:28","Claus Kvist Hansen (DF):","Tak for det. Mener ministeren, at Danmark fortsat kan retfærdiggøre at yde økonomisk bistand og anden støtte til Tanzania, når man i Børsen den 4. november 2018 kan læse, at USA advarer sine borgere i Tanzania om at være forsigtige, efter myndighederne i det østafrikanske land har meddelt, at de vil slå ned på homoseksuelle og andre lgbt-personer i Tanzania? LINEBREAK ","60"
"13:38","Simon Kollerup (S):","Tak for det, og spørgsmålet lyder: Mener ministeren i ramme alvor, at regeringens omprioriteringsbidrag ikke øger risikoen for, at Morsø Gymnasium lukker, når hun til Morsø Folkeblad udtaler, at »De gymnasier, der er karakteriseret som udkantsgymnasier, klarer sig udmærket, når man kikker på deres regnskaber«? LINEBREAK ","45"
"13:52","Transport-, bygnings- og boligministeren (Ole Birk Olesen):","Det bør der selvfølgelig være noget kontrol med. Det hører desværre ikke under mit resort, men under Skatteministeriets ressort, fordi det er dem, der opkræver både told og moms og afgifter osv. Men selvfølgelig skal der være en kontrol, og det er jeg også sikker på der er. LINEBREAK ","48"
"14:20","Miljø- og fødevareministeren (Jakob Ellemann-Jensen):","Som jeg nævnte det før, står min dør altid åben, og fra tid til anden er jeg også inde på mit kontor og vil have lejlighed til at tage sådan en drøftelse med spørgeren. Sådan en drøftelse tager jeg naturligvis gerne. LINEBREAK ","41"
"14:29","Søren Egge Rasmussen (EL):","Tak. Fødevarestyrelsens undersøgelse for 2017 af pesticidrester i danske fødevarer er blevet afsluttet, og Fødevarestyrelsen vurderer, at det er »glædeligt, at stort set alle fund af pesticider i frugt og grønt er uskadelige og under grænseværdierne« – deler ministeren glæden, og kan ministeren garantere, at pesticidrester under grænseværdierne er uskadelige, uanset hvor mange forskellige pesticidrester befolkningen indtager? LINEBREAK ","57"
