"11:32","Mattias Tesfaye (S):","Tak. Jamen jeg har forstået, at Alternativet mener, at uddannelse skal tælle med i beskæftigelseskravet, men jeg kunne godt tænke mig at spørge: Mener Alternativet egentlig, at der overhovedet skal være et beskæftigelseskrav? Eller mener Alternativet, at også folk, der f.eks. har været på kontanthjælp, skal kunne få permanent ophold? LINEBREAK ","50"
"11:32","Mattias Tesfaye (S):","Tak. I dag siger vi, at man kan søge permanent ophold efter 8 år, og at man skal have haft arbejde i mindst 3½ år. Er det Alternativets holdning, at beskæftigelseskravet fortsat skal være 3½ år, men at uddannelse så bare skal tælle med, eller ønsker Alternativet at sætte den der 3½-årsgrænse ned? LINEBREAK ","53"
"11:36","Andreas Steenberg (RV):","Nej, vi synes, at Socialdemokratiet skulle vende tilbage til det, I mente, da I sad i regering med os. Da var det 6 år, og det var, så vidt jeg husker, 3 års beskæftigelse, hvor uddannelse kunne tælle med, og så var der selvfølgelig krav om at have lært dansk og have overholdt lovgivningen. LINEBREAK ","54"
"11:37","Mattias Tesfaye (S):","Så Det Radikale Venstres holdning til det her spørgsmål er, at det skal være 6 års ophold i Danmark og 3 års beskæftigelse, hvori uddannelse tæller med. Så er lovgivningen nogenlunde dér, hvor Det Radikale Venstre ønsker, at den skal være. LINEBREAK ","41"
"11:56","Udlændinge- og integrationsministeren (Inger Støjberg):","Jo, vi kender godt til erhvervsuddannelserne, også ovre i Udlændinge- og Integrationsministeriet, men det handler jo om, at så længe man er i en eller anden form for uddannelse, så må man lige vente med at tælle det med. Jeg ser ganske enkelt ingen grund til at ændre på det, det må jeg sige. LINEBREAK ","54"
"13:22","Claus Kvist Hansen (DF):","Der har ikke været nogen uenighed om Yemenspørgsmålet, vil jeg sige. Men ud fra en samlet vurdering besluttede vi i Dansk Folkeparti, at spørgsmålet om situationen i Yemen måske egentlig hører til i en diskussion for sig selv. Det er baggrunden for, at vi kan støtte op om regeringens udkast. LINEBREAK ","50"
"13:43","Sofie Carsten Nielsen (RV):","Det synes jeg også, og tak for den oplysning, så den også indgår i debatten. Og hermed også en opfordring til at forsøge – det er jo så særlig til regeringen – at finde det fælles kompromis, for det synes jeg ville se ordentligt ud. LINEBREAK ","45"
