"13:24","Karina Due (DF):","Det vil altså sige, at ministeren synes, det er fuldstændig uproblematisk, at man uden at vide det kan betale til Islamisk Kulturcenter, når man går ned og køber sine dagligvarer – medmindre man har tid til at sidde ved computeren og undersøge samtlige produkter for at finde ud af, om den her virksomhed betaler til Islamisk Kulturcenter. LINEBREAK ","57"
"13:26","Miljø- og fødevareministeren (Jakob Ellemann-Jensen):","Altså, hvilke certificeringsordninger, som private virksomheder, hvis produkter, man som forbruger aktivt kan vælge til eller fra, vælger at anvende, så længe de ikke vildleder forbrugeren, er simpelt hen ikke lige inden for miljø- og fødevareministerens ressort. Og det har jeg i kapacitet af miljø- og fødevareminister ikke nogen holdning til. LINEBREAK ","51"
"13:43","Jens Joel (S):","Tak for det. Vil regeringen snart genoptage de forhandlinger om en omlægning af reglerne for overskudsvarme, som vi med det seneste energiforlig blev enige om skulle være på plads i efteråret 2018, men hvor der ikke har været indkaldt til møder siden september 2018? LINEBREAK ","44"
"14:07","Astrid Krag (S):","Tak for det, formand. Spørgsmålet lyder: LINEBREAK Mener ministeren, at det er muligt at flytte 500.000 behandlinger fra sygehusene til det nære sundhedsvæsen, uden at der skal følge en eneste læge fra sygehuset med, sådan som Lars Løkke Rasmussen lovede forsamlingen til debatmødet i Hovborg, jf. Avisen Danmark den 1. februar 2019? LINEBREAK ","51"
"14:33","Rasmus Prehn (S):","Tak, formand. Kan ministeren garantere over for de nordjyder, som i dag finder tryghed i at have en akutlægebil tilknyttet Hjørring Sygehus, at denne akutlægebil ikke i fremtiden vil blive sparet væk af embedsmænd og bestyrelsesmedlemmer i sundhedsforvaltninger, som ikke er valgt ind af borgerne i Nordjylland, men som i stedet er udpeget af Sundhedsministeriet i København? LINEBREAK ","57"
"14:55","Flemming Møller Mortensen (S):","Tak, formand. Spørgsmålet lyder: LINEBREAK Kan ministeren garantere, at sygehuset i Frederikshavn ikke bliver lukket, når det fremover med regeringens sundhedsreform ikke længere skal være op til folkevalgte fra Nordjylland, men i stedet en bestyrelse udpeget af Sundhedsministeriet i København at beslutte, hvordan sygehusstrukturen skal se ud? LINEBREAK ","46"
"16:16","Naser Khader (KF):","Der er både kristne og ikkekristne, der ikke føler, at de har frihed under besættelsen, så det handler ikke kun om de kristne der. Det gælder også muslimske palæstinensere. Men faktum er, at der, hvor islamisterne er styrket, har de kristne og andre anderledes religiøse mindretal det også svært. LINEBREAK ","49"
"16:33","Christian Langballe (DF):","Jamen altså, bifald herfra, selvfølgelig. Det er klart, at der er nogle sager, som ikke egner sig til, at forhandlingen skal foregå i landets aviser eller på fjernsyn. Sådan er det, det anerkender jeg fuldt ud. Jamen det er i orden, tak for det. LINEBREAK ","44"
