"13:01","Rasmus Vestergaard Madsen (EL):","Tak. Spørgsmålet lyder: LINEBREAK Vil ministeren på baggrund af professor i miljøret Ellen Margrethe Basses udtalelser i artiklen »Ny udfordring for regeringens Lindholmprojekt: To truede fuglearter bor på øen« på dr.dk sikre, at der foretages en konsekvensvurdering for Natura 2000-området, hvor Lindholm ligger, forud for etableringen af det nye udrejsecenter? LINEBREAK ","49"
"13:05","Rasmus Vestergaard Madsen (EL):","Det er lidt ærgerligt, at ministeren ikke kender de konkrete dele, der ligger i regeringens plan. Men måske ministeren så i hvert fald kan oplyse mig og resten af den danske befolkning om, hvornår der vil blive udpeget en bygherre, som vel må få de tegninger, som skal ligge til grund for det kommende Lindholmprojekt? LINEBREAK ","55"
"13:25","Rasmus Vestergaard Madsen (EL):","Tak. Spørgsmålet lyder: Vil ministeren kommentere artiklen »Hjemløse André sigtet for at bryde zoneforbud« på www.tv2lorry.dk den 28. december 2018, herunder oplyse, om han finder det rimeligt og i overensstemmelse med lovens intention, at en hjemløs, som er idømt zoneforbud, skal 7 dage i fængsel for at drikke en kop kaffe med en ven, mens han venter på bussen? LINEBREAK ","59"
"13:33","Kenneth Kristensen Berth (DF):","Ja, tak for det. Spørgsmålet lyder: Vil ministeren imødekomme Ishøj Kommune og Boligforeningen AAB's ønske om at skabe lovgivningsmæssig hjemmel til, at der kan etableres videoovervågning i boligområdet Ågården i Ishøj Kommune, der har været udsat for et stort antal bilbrande i den seneste tid? LINEBREAK ","45"
"13:40","Kenneth Kristensen Berth (DF):","Tak for det. Hvis ministeren ikke mener, at Boligforeningen AAB og Ishøj Kommune skal have lovgivningsmæssig hjemmel til at etablere videoovervågning i boligområdet Ågården i Ishøj, hvilke forslag har ministeren så til, hvordan man kan komme de mange bilbrande, der har præget området, til livs, og hvad agter ministeren at gøre for at øge borgernes tryghed i det berørte område? LINEBREAK ","60"
"13:53","Peter Kofod (DF):","Så vil jeg spørge ind til den del i lovforslaget, der handler om de private. Sådan helt skarpt stillet op, vil ministeren så karakterisere det, der er lagt op til i lovforslaget, nemlig en udvidelse af privates mulighed for at bruge videoovervågning, som vidtgående? LINEBREAK ","44"
"14:02","Lars Aslan Rasmussen (S):","Vil ministeren forklare, om hun stadig står ved følgende citat fra 2017, eller om hun bare har skiftet holdning/standpunkt: »Som ordfører har min holdning været meget klar: At prostitution ikke er et almindeligt erhverv, ikke kan sidestilles, og det er sådan set også min holdning i dag som minister«? LINEBREAK   LINEBREAK   LINEBREAK   LINEBREAK ","49"
"14:15","Simon Kollerup (S):","Mener ministeren, at der er behov for initiativer, der kan vende den triste statistik, der fortæller, at Morsø Kommune er den kommune i Nordjylland, hvor den højeste andel af borgere over 18 år har en psykiatrisk diagnose, jf. artiklen »Morsø er den nordjyske kommune med flest psykisk syge« i TV 2 Nord den 8. januar 2019? LINEBREAK   LINEBREAK ","56"
