"13:20","Holger K. Nielsen (SF):","Jeg kan sige, at vi også støtter det her forslag. Der er sagt mange fornuftige ting, som jeg ikke skal gentage. Men generelt styrker det retssikkerheden, og det er et fornuftigt område at arbejde sammen om. Derfor er det naturligt for SF at bakke op om det her. LINEBREAK ","48"
"13:26","Justitsministeren (Søren Pind):","Man siger jo ikke, at man ikke vil oplyse det. Man siger, at det endnu er for tidligt at sige noget om det. Sagen er, at stillet over for de fordele, der er ved det her direktiv, så er det sådan set et mindre spørgsmål i øjeblikket. Nu vender jeg så også tilbage til sagen i Europaudvalget. LINEBREAK ","57"
"14:04","Josephine Fock (ALT):","Tak for det, og tak til ordføreren. Kan ordføreren ikke uddybe, hvad det er, der gør, at de af Udenrigsministeriet udpegede medlemmer til Flygtningenævnet ikke er neutrale, når de embedsmænd, der kommer fra Udlændinge- og Integrationsministeriet er det? Det syntes jeg ikke jeg kunne høre i talen. LINEBREAK ","47"
"14:14","Finn Sørensen (EL):","Jeg har ikke brugt vendingen, at vi kan være et hundrede procent sikre på, at de er upartiske, for en sådan garanti kan man ikke give for nogen mennesker. Den kan man heller ikke give for de mennesker, der er udpeget af Integrationsministeriet. LINEBREAK ","43"
"14:46","Udlændinge-, integrations- og boligministeren (Inger Støjberg):","Jeg tror bare, man må sige, at det er et faktum, at når Socialdemokratiet er i regering, er det De Radikale, der bestemmer udlændingepolitikken. Sådan har det altid været, og hvorfor i alverden skulle det blive lavet om nu? Der er i hvert fald ikke noget, der tyder på det med hr. Tesfayes tale her i dag. LINEBREAK ","57"
"15:37","Leif Lahn Jensen (S):","Jeg har så lige en anden forringelse: Ifølge forslaget skal kommunen også træffe afgørelse om, hvorvidt gifte eller fraseparerede personer, der ikke lever sammen med ægtefællen på fælles bopæl, er samlevende eller enlige i forhold til kontanthjælpsloftet. Det vil medføre, at flere får boligsikringen eller -støtten nedsat. Er det også positivt? LINEBREAK ","51"
"16:12","Beskæftigelsesministeren (Jørn Neergaard Larsen):","Det har jeg ikke talmateriale til at kunne sige. Jeg vil gerne undersøge det og svare på det skriftligt, men jeg har ikke talmateriale her, så jeg her og nu præcist kan sige, hvilket rådighedsbeløb en bestemt familietype med et bestemt antal børn har. Men jeg svarer meget gerne på det. LINEBREAK ","51"
"17:18","Pelle Dragsted (EL):","Jeg vil bare høre ministerens syn på eventuelt at dele lovforslaget op, i og med at vi er flere ordførere, som har meddelt, at den ene del er der sådan set bred opbakning bag. LINEBREAK Er det noget, der kunne blive aktuelt? LINEBREAK ","41"
