"10:45","Marlene Harpsøe (DF):","Tak til ordføreren for ordførertalen. Det er jo glædeligt at høre i svaret til hr. Martin Henriksen, at Socialdemokraterne er klar til at diskutere yderligere stramninger, men gælder det også en hjemsendelsesstrategi for de flygtninge, der er her i landet, som ikke bidrager til det danske samfund? Gælder det også det? LINEBREAK ","51"
"11:30","Laura Lindahl (LA):","Jeg vil egentlig sige, at jeg ikke mener, at det, at vi forsøger at skubbe flygtninge i job, er en påbegyndt trappestige mod et statsborgerskab i Danmark. Jeg mener, at de skal have et job, fordi vi ikke skal forsørge dem. Men når der igen er trygt og sikkert i deres land, skal de hjem. LINEBREAK ","55"
"11:38","Finn Sørensen (EL):","Tak. Jeg synes, at ordføreren sagde – sådan hørte jeg det i hvert fald – at der p.t. ikke er nogen danskere, der vil tage de job, som flygtningene bliver sendt ud i i virksomhedspraktik. Hvor ved ordføreren det fra? LINEBREAK ","40"
"11:38","Laura Lindahl (LA):","Det, jeg henviste til, var et helt konkret eksempel med buschauffører i hovedstadsområdet, hvor man har udfordringer med at finde danske chauffører. Derfor har man indgået en aftale med Frederiksberg Kommune om at uddanne flygtninge med henblik på at kunne ansætte dem. Det er ifølge dem selv, fordi de ikke kan finde arbejdskraft i Storkøbenhavn. LINEBREAK ","55"
"12:16","Karsten Hønge (SF):","Jeg kan starte med at sige, at fru Marlene Harpsøe overhovedet ikke skal blande sig en snus i hverken længden eller indholdet af SF's ordførertaler. Overhovedet ikke! Som det første i min ordførertale var, at de udgifter, som er forbundet med den mislykkede integration, selvfølgelig er noget, som betyder rigtig meget for SF. LINEBREAK ","53"
"13:58","Torsten Gejl (ALT):","Den er, at det er mig, der bestemmer i den her sag. Det er mig, der er beskæftigelsesordfører for Alternativet. Henrik Marstal er folketingskandidat for Alternativet, og han må gerne lufte den type meninger. Men det er det, som jeg siger, der gælder, og det er, at vi ikke vil sanktionere ved at tage kontanthjælp fra nogen som helst. LINEBREAK ","59"
