"14:36","Lisbeth Bech Poulsen (SF):","Tak. Hvad siger ministeren til Forbrugerombudsmanden og Forbrugerrådets bemærkninger om, at den her oversættelse, hvor man bruger ordet væsentligt, hverken stemmer overens med direktivets oprindelige ordlyd eller intentionen i det? Jeg er sikker på, ministeren er bekendt med den del af kritikken, som Forbrugerombudsmanden og Forbrugerrådet er kommet med. LINEBREAK ","49"
"14:38","Erhvervs- og vækstministeren (Troels Lund Poulsen):","Jeg vil gerne også i dag sige – og nu har vi jo som ofte rig lejlighed til at diskutere ting her i Folketingssalen – at ministeren altid er lydhør over for gode forslag fra SF og ikke mindst fra fru Lisbeth Bech Poulsen, specielt hvis de giver god mening. LINEBREAK ","50"
"15:46","Carsten Bach (LA):","Tak for svaret. Skal jeg dermed forstå ordføreren for Venstre således, at det har været en del af de konkrete politiske forhandlinger, at lige præcis organisationen Danmarks Naturfredningsforening skulle have eneret på indstillingen fra ministeren i forhold til at udpege fagpersonen på natur- og miljøområdet? LINEBREAK ","45"
"15:51","Carsten Bach (LA):","Det er jo netop i lovforslaget fremsat på den måde, at de fagpersoner, som ordføreren begræder sidder i nævnet udpeget af erhvervene, bliver udpeget af en gruppe af interesseorganisationer, hvorimod fagpersonen på natur- og miljøområdet ensidigt bliver indstillet af Danmarks Naturfredningsforening. Jeg ved ikke, om det ændrer på ordførerens mening om det. LINEBREAK ","52"
"17:26","Johanne Schmidt-Nielsen (EL):","Jeg beklager, men nu er det meget uklart for mig, hvad SF faktisk mener. Siger hr. Holger K. Nielsen nu fra talerstolen, at SF ikke vil støtte, at det bliver undersøgt, hvordan mænd, som ikke er dømt for vold, kan pålægges en karensperiode på f.eks. 10 år, hvor de ikke kan få en familiesammenføring? LINEBREAK ","54"
"17:41","Marcus Knuth (V):","Må jeg så ikke bare lige for en god ordens skyld for at være helt sikker på, at jeg har forstået det, ordføreren siger, spørge: Såfremt ordføreren sad med regeringsmagten – eller det skulle ske inden for den nærmeste fremtid – ville man så implementere det her forslag ordret, som det står her? LINEBREAK ","53"
"18:23","Finn Sørensen (EL):","Det synes Enhedslisten stadig væk. Det er bare ikke det, vi diskuterer her. Vi diskuterer, at partierne i den blå blok har gennemført en lovgivning, der er voldsomt indgribende over for udsatte mennesker i det her land, og så forsøger vi at samles med alle de partier, der vil det til livs. LINEBREAK ","52"
"18:48","Leif Lahn Jensen (S):","Fru Mette Frederiksen har sagt ved konferencen: Lur mig, om vi ikke kigger på det. Og jeg har sagt, at vi vil gøre alt, hvad vi kan, for at give de her mennesker et bedre liv, når vi kommer til, og det synes jeg da også er store ord. LINEBREAK ","49"
"18:54","Helle Osther Friedrichsen (EL):","Tak. Ordføreren har lige sagt, at Socialdemokratiet ikke er ansvarlig for de mange kontanthjælpsmodtagere. Men under den seneste regering besluttede Socialdemokratiet sammen med deres regeringspartnere førtids- og flekstidsreformen, og mange af disse mennesker er i dag på kontanthjælp. LINEBREAK Så jeg skal lige høre ordføreren, om Socialdemokratiet ikke synes, man har et ansvar. LINEBREAK ","52"
"19:13","Julie Skovsby (S):","Tak for det. Ordføreren sagde her i salen: Ingen syge eller mennesker med handicap skal være på kontanthjælp. Derfor er mit spørgsmål: Er det stadig Dansk Folkepartis holdning, og vil Dansk Folkeparti arbejde for at få de her mennesker undtaget fra lovgivningen? LINEBREAK ","42"
"19:24","Marlene Harpsøe (DF):","Tallene er, som tallene er. Det er sådan, at vi har indført et kontanthjælpsloft og en 225-timersregel, og der er nogle mennesker, som bliver omfattet af de regler. Og udviklingen er, som den er, og den kan jeg ikke ændre på. (Kommentar fra salen). LINEBREAK ","44"
"19:53","Lennart Damsbo-Andersen (S):","Så vil jeg godt fortsætte ned ad det spor, for hvis det nu er så nemt at få arbejde, som ordføreren siger, og at der er hundredtusindvis af jobs derude, hvordan kan det så være, at jobcentrene ikke for længst har fået alle kontanthjælpsmodtagerne ud i arbejde? Hvad kan baggrunden være for det? LINEBREAK ","53"
"19:59","Hans Andersen (V):","Nu vil jeg bare opfordre spørgeren til at følge med. Det er ikke en udmelding fra Glostrup Kommune, som kan bekræftes. Så hvis spørgeren fulgte med i situationen og debatten på beskæftigelsesområdet, ville han vide, at det ikke er politikken i Glostrup Kommune. LINEBREAK ","43"
"20:24","Kirsten Normann Andersen (SF):","Interessant svar. Det kan vi måske tales ved om til overenskomstforhandlingerne i 2019. Jeg hjælper lige ordføreren, fordi forskellen mellem 22.000 og 14.000 er 8.000 kr. i bruttolønnen. Hvis man trækker de 8 pct. arbejdsmarkedsbidrag fra, er der stadig væk en forskel på 6.000 kr. De øvrige tillæg er ens. Hvad er forskellen på de to lønninger? LINEBREAK ","57"
"20:24","Joachim B. Olsen (LA):","Det er jo underligt at bede mig om på Folketingets talerstol at svare på sådan et spørgsmål – altså, det er jo dybt underligt. Jeg kan jo ikke stå her og lave udregninger på et minut, det giver ikke mening. LINEBREAK ","40"
"20:31","Hans Andersen (V):","Så skal jeg forstå det således, at det vil betyde, at det ikke længere kan betale sig at gå i arbejde, altså at tage et job til 18.000 kr. om måneden. Er Alternativet af den opfattelse, at økonomiske incitamenter ikke virker, når det handler om at få mennesker i arbejde? LINEBREAK ","50"
"20:47","Karsten Hønge (SF):","Det synes vi er træls. Til gengæld vil vi jo benytte enhver lejlighed til at minde dem om de ting, de har sagt, for vi har jo tidligere hørt hr. Leif Lahn Jensen være klar i sin afvisning af de lavere ydelser. Men vi synes, det er noget socialdemokratisk fedtspilleri. LINEBREAK ","50"
"20:47","Marlene Harpsøe (DF):","Nu har Socialdemokratiet sådan set tidligere meldt, at man gerne ønsker et kontanthjælpsloft, men at det bare ikke lige er i den udformning, som V og K og DF og LA har vedtaget. Vil man fra SF's side være villig til at indlede nogle forhandlinger med Socialdemokratiet i forhold til et nyt kontanthjælpsloft, et anderledes kontanthjælpsloft? LINEBREAK ","56"
"20:47","Karsten Hønge (SF):","Nej, det, vi vil lave forhandlinger med Socialdemokratiet om, er at få fjernet kontanthjælpsloftet, og det føler jeg mig også ret sikker på vores kammerater i Socialdemokratiet vil være med på efter et valg, hvor højrefløjen til gengæld skal have den her omtalte stemmemæssige olfert. LINEBREAK ","45"
"20:51","Hans Andersen (V):","Men skal vi så forstå det på den måde, at SF sådan set synes godt om kontanthjælpsloftet, når vi taler om jobparate kontanthjælpsmodtagere, altså at jobparate godt kan blive omfattet af kontanthjælpsloftet, hvorimod aktivitetsparate ikke skal omfattes af kontanthjælpsloftet? Er det en mulighed, som ordføreren ser for sig? LINEBREAK ","48"
"21:44","Søren Egge Rasmussen (EL):","Jamen så håber jeg da, at der er nogle inden for andelsboligsektoren, der lytter til den her debat. Lad os så se, om vi får nogle flere eksempler frem. Det kunne være rigtig spændende, for hvis der er det, er der jo optræk til, at vi måske skulle lave en hurtig handling. LINEBREAK ","52"
"21:47","Kaare Dybvad (S):","Ja, og vi ser frem til det. Det er ikke for at trække det ud eller noget, men hvis vi forestiller os, at en andelsbolig antager en form som en ejerbolig, skal man så stadig have den skattefordel i andelsboligen, som der jo ikke er i en ejerlejlighed? LINEBREAK ","48"
"21:48","Marcus Knuth (V):","Der må jeg helt ærligt blive svar skyldig, som jeg sagde. Jeg dækker det her område for boligordføreren, og jeg har sat mig ind i præcis det her område. Men spørgsmålet ligger lidt uden for den diskussion, vi har om tilbudspligt. LINEBREAK ","41"
"21:58","Ole Birk Olesen (LA):","Jeg har ikke sagt, det er alle handler. Jeg har sagt, at der foretages rigtig mange handler, hvor boligerne via tilbudspligten omdannes til andelsboligforeninger. Det fører jo så hver eneste gang til, at der er en opgang mindre, som bliver udlejet i privat udlejningsregi, og en opgang mere, som er andelsboligforening. LINEBREAK ","51"
