"12:08","Trine Bramsen (S):","Ja, det er jo sådan set derfor, at vi gerne vil have ændret opholdsdirektivet. Det er jo lige at gå den rigtige vej i det her. Opholdsdirektivet ser vi meget gerne bliver ændret, så man slet ikke har et opholdsgrundlag i Danmark, hvis man ikke har et sted at bo og ikke har noget at tage sig til her. LINEBREAK ","59"
"12:15","Trine Bramsen (S):","Nej, i det utryghedsskabende ligger der jo, at der er en form for aggressiv karakter, og jeg kan give et eksempel fra min lokale Netto for et par uger siden. Her var der en person, der løb efter alle de handlende, der kom ud, og rørte ved dem, og det havde en meget aggressiv karakter. Det er utryghedsskabende betleri. LINEBREAK ","59"
"12:24","Zenia Stampe (RV):","Nu forsøger jeg med Dansk Folkeparti, for I har jo fremsat det her forslag tidligere, så derfor kan det være, I kan afklare spørgsmålet om, hvorvidt danske Kenneth, der tigger i et S-tog, også vil blive ramt af de her regler. LINEBREAK ","41"
"12:24","Martin Henriksen (DF):","Hvis man overtræder de regler, der er i lovforslaget, vil man jo kunne blive straffet, uanset om man har det ene eller det andet statsborgerskab. Men i mange af de her situationer vil det også være op til en konkret vurdering fra politiets side. LINEBREAK ","44"
"13:17","Marcus Knuth (V):","Det er også sket for mig. Men lad mig så gå videre til en anden del. Hvis ordføreren afviser at skærpe straffen for tiggeri, vil ordføreren så gå med til f.eks. at skærpe straffen for nogle af de andre ting? Vil ordføreren være åben over for en dialog om f.eks. fængselsstraf for at danne en af de her såkaldte romalejre? LINEBREAK ","60"
"13:18","Naser Khader (KF):","Jeg vil gerne gentage det spørgsmål, som jeg stillede til ordføreren for Enhedslisten. Ordføreren for Alternativet nævnte eksemplet med tiggeren, der tigger om 5 kr., men har ordføreren et eksempel på, at en tigger, der tigger om 5 kr., er blevet fængslet eller retsforfulgt? LINEBREAK ","44"
"13:49","Martin Henriksen (DF):","Tak for det. Skal jeg forstå det sådan, at justitsministeren er parat til at gøre det nemmere at udvise? Nu mangler vi bare lige, at udlændingeministeren også er parat til det; så er der jo flertal for det i Folketinget. LINEBREAK ","40"
"13:49","Rune Lund (EL):","Der har jo været lidt uklarhed i debatten, må man sige, om, hvad det her lovforslag egentlig går ud på. Og derfor vil jeg gerne stille justitsministeren spørgsmålet, om det her forslag vil ramme en dansk hjemløs, der rækker koppen eller hånden frem for at tjene en mønt til at købe en kop kaffe for. LINEBREAK ","55"
"13:51","Rune Lund (EL):","Så hvis man måtte have det synspunkt, at vi i Danmark i en årrække har haft gammeldags vagabonder og hjemløse, hvor vi har kunnet få det til at fungere, så må man konstatere, at de mennesker også vil blive ramt af stramningerne i det her lovforslag. Er det rigtigt forstået? LINEBREAK ","50"
