"13:46","Christian Juhl (EL):","Tak. Jeg vil gerne spørge ordføreren, om ikke hun synes, det er besynderligt, at stort set alle socialdemokratiske borgmestre i det her land har en dagsorden, hvor man netop har fjernet brugen af tredjeperson og taler mere direkte til hinanden og dermed har et mere levende sprog i byrådene, og det samme gælder i regionsrådene. LINEBREAK ","55"
"13:51","Christian Juhl (EL):","Det var egentlig ikke det, jeg spurgte om. Det var noget med, hvordan ordføreren mener respekten og ordentligheden er i byråd, regionsråd, Nordisk Råd og udvalg osv. Så vil jeg godt tilføje, om ikke også ordføreren er opmærksom på, at sproget blandt danskere faktisk udvikler sig, selv om man taler ordentligt til hinanden i langt de fleste forsamlinger. LINEBREAK ","58"
"13:51","Peter Kofod Poulsen (DF):","Selvfølgelig udvikler sproget sig. Det er helt naturligt. Men jeg synes, det er helt på sin plads, at vi her i Folketinget gør vores ypperste for at sørge for, at vores debatter foregår på en ordentlig måde, på en respektfuld måde. Ellers tror jeg simpelt hen, at danskerne slukker. Det er meget simpelt. LINEBREAK ","53"
"15:09","Karina Adsbøl (DF):","Man nævner dialog. Nu er det sådan, at vi har nogle kommuner, som har svært ved at overholde lovgivningen, også trods det, at der er gentagne hjemvisninger fra Ankestyrelsen, og så kører det frem og tilbage. Når der er tale om lovbrud og man ikke følger lovgivningen, er Venstres forslag så, at vi skal have dialog? LINEBREAK ","56"
"15:11","Carl Holst (V):","Jo, det synes jeg, og det er det, der er formålet med taskforcen. Jeg tror, at det faglige råd og sparring jo netop bygger på dialog, og det er det, der kommer til udtryk, når den satspuljefinansierede taskforce stiller sig til rådighed og kommunerne tager imod den. LINEBREAK ","47"
"15:36","Torsten Gejl (ALT):","Jo, men på den baggrund at sige, at vi skal til at tvinge kommunerne til at gøre det her og så sanktionere dem, hvis de ikke gør det, synes jeg er langt at gå. I Alternativet er vi virkelig, virkelig glade for det kommunale selvstyre, så vi er klar til at gå dybere for at finde alternativer til den løsning. LINEBREAK ","60"
