"11:02","Zenia Stampe (RV):","Tak for det. Og tak til justitsministeren for at stille op til denne forespørgselsdebat. Hvis jeg kender justitsministeren ret, er det her er et emne, som ligger ham mindst lige så meget på sinde, som det gør for os ...  LINEBREAK ","40"
"11:18","Kenneth Kristensen Berth (DF):","Jeg kan forstå, at fru Zenia Stampe har bevæget sig til Det Gule Danmark, og det er jo altid rart at komme ud og besøge nogle af dem, man ikke forstår. Men jeg kunne egentlig godt tænke mig at stille fru Zenia Stampe et meget konkret spørgsmål. Hvordan søger man i Europol? LINEBREAK ","52"
"11:31","Zenia Stampe (RV):","Det er jo bl.a. derfor, vi har en forespørgselsdebat; det er for at spørge ind til den slags ting. Det her handler ikke om at quizze mig om Europol. Det handler faktisk om at få et dybdegående kendskab netop til den type spørgsmål. Det er derfor, jeg har inviteret til forespørgselsdebatten. LINEBREAK ","51"
"11:32","Carsten Kudsk (DF):","Så lad mig spørge på en anden måde. Nu er fru Zenia Stampe så uheldig, at jeg desværre lige har været på besøg i Europol. Hvad betyder det, når et tredjeland retter henvendelse – det, der kaldes en akut henvendelse – om en potentiel terrorist? Hvor hurtigt kan man få de oplysninger fra Europol? LINEBREAK ","54"
"11:36","Rune Lund (EL):","Jeg vil gerne spørge fru Zenia Stampe om, hvad fru Zenia Stampe mener om karakteren af den adgang til databaser, som danske politifolk i dag har adgang til i Europol, når en politibetjent står på grænsen og laver en søgning i Europol. LINEBREAK ","42"
"11:37","Rune Lund (EL):","Når politiet så i dag står nede ved grænsen og slår op i Europol og har den adgang, får politiet nogle oplysninger. Hvad mener ordføreren om karakteren af de oplysninger, som politiet i dag med den nuværende ordning har adgang til? LINEBREAK ","41"
"11:37","Zenia Stampe (RV):","Jeg forstår ikke spørgsmålet, men jeg må sige, at et af de spørgsmål, jeg selv er interesseret i at få besvaret, netop er, hvad det vil betyde for grænsekontrollen, hvis man ikke har adgang til at bruge Europol på grænsen. Det er et spørgsmål, jeg også er meget interesseret i at få svar på. LINEBREAK ","54"
"11:45","Zenia Stampe (RV):","Jeg kender Dansk Folkepartis holdning til Schengensamarbejdet. Man må jo sige, at nu har vi en grænsekontrol baseret på stikprøver, og den har vi efter aftale med EU. Så på den måde er der jo dispenseret i en vis grad fra reglerne under indtryk af, hvad man sige, flygtningekrisen. LINEBREAK ","49"
"13:25","Jakob Ellemann-Jensen (V):","Ahr, lad mig nu prøve lidt alligevel. Er det et krav fra Dansk Folkepartis side, at dansk politi skal kunne søge i det informationssystem – det europæiske informationssystem – som vi har talt om tidligere, f.eks. i forbindelse med den grænsekontrol, som jeg forstår at ordføreren er så utrolig begejstret for? LINEBREAK ","51"
"14:08","Søren Søndergaard (EL):","Det er klart, at i EU, hvor man har indført de fem friheder – friheden for arbejdskraft, friheden for kapital, friheden for tjenesteydelser, friheden for varerne og friheden for kriminaliteten til at flyde over grænserne – bliver man selvfølgelig nødt til, hvis man vil bekæmpe kriminalitet, at have grænseoverskridende politisamarbejde. Sådan er det. Og det støtter vi fuldt ud. LINEBREAK ","59"
"14:24","Holger K. Nielsen (SF):","Nej, det kan jeg forsikre om. Jeg kender ikke noget til de forhandlinger. Det ville også være aldeles upassende, hvis jeg gjorde. DF's forhold til vælgerne skal jeg såmænd ikke kommentere. Jeg tror nu nok, at der er sådan lidt vanskeligheder i øjeblikket. Er der ikke det, eller hvad? LINEBREAK ","49"
"15:06","Rasmus Horn Langhoff (S):","Det er, fordi ligestilling og demokrati til enhver tid i det danske samfund bør stå over religiøse særhensyn, til enhver tid. Jeg kan ikke finde et eneste eksempel på, at jeg ønsker at bøje hverken ligestillingen eller demokratiet eller unges og børns rettigheder til at blive velfungerende borgere her i landet på grund af nogle religiøse særhensyn. LINEBREAK ","57"
"15:07","Carolina Magdalene Maier (ALT):","Men hvor er det lige præcis, at ligestillingen tager skade her? Tager den ikke meget mere skade, hvis de her piger og kvinder, som kan gå til svømning, fordi der kun er andre kvinder der, bliver derhjemme, inde bag husets mure? Er det ikke til meget større skade? LINEBREAK ","48"
"16:42","Anni Matthiesen (V):","Nu ved jeg godt, at det er begrænset, hvor meget tid vi har, men jeg kunne godt tænke mig at spørge direkte: Hvad mener Enhedslisten så skulle være den klogere løsning? I ordførertalen nævnte ordføreren, at bonussen var for lille. Hvad skal der til, for at Enhedslisten mener, at den her bonus er stor nok? LINEBREAK ","55"
"17:25","Annette Lind (S):","Som sagt har vi haft rigtig mange besøg i udvalget og senest også i den her uge, som ordføreren selv siger. Anerkender ordføreren ikke, at det her er noget, som brugerne er dybt, dybt bekymrede over? Og så vil jeg spørge ordføreren, om ordføreren tror, at ændringerne i niveauet for skoleydelsen får konsekvenser for elevtilgangen. Tak. LINEBREAK ","56"
"17:31","Jakob Sølvhøj (EL):","Jeg må forstå det sådan, at Venstreregeringen altså har nedsat en ekspertgruppe, som i 11 måneder har siddet og arbejdet med det, og nogle ganske få uger før ekspertgruppen skulle aflevere sin rapport har regeringen syntes, at det arbejde, den selv havde sat i gang for at vurdere spørgsmålet om produktionsskoleelevernes skoleydelse, var overflødigt. LINEBREAK ","54"
"17:40","Karsten Hønge (SF):","Helt okay. Det er friskt, det er bare i orden. Det er sjældent, vi hører nogen trække noget tilbage – super! LINEBREAK Så vil jeg spørge til en anden ting, og det er: Hvor mange færre elever forventer ordføreren der vil komme på produktionsskolerne, når man nu skærer hårdt ned på ydelsen? LINEBREAK ","51"
"17:46","Anni Matthiesen (V):","Jeg vil ikke stå her i Folketingssalen i dag og gætte på, hvordan det bliver, når vi forhåbentlig har fået en fælles aftale om en SU-reform. Det ville være rent gætteri fra min side, og jeg vil ikke stå her og love, at det så påvirker ydelsen for produktionsskoleeleverne. LINEBREAK ","49"
"17:56","Henrik Dahl (LA):","Nej, der er det udmærket at man ligesom har to systemer, der afspejler to forskellige skolevirkeligheder. Men der er jo ikke nogen sådan tvingende grund til, at ydelser lige præcis skal have den ene størrelse eller den anden størrelse. Det er jo tit nogle lidt tilfældige historiske vilkår, der afgør, at man lander, hvor man lander. LINEBREAK ","56"
"17:57","Karsten Hønge (SF):","Jeg har jo tidligere i dag prøvet på at få et svar, og nu prøver jeg igen. Der står i det fremsatte lovforslag, at det er vigtigt, at ydelsesniveauet ikke afgør unges valg af skole- eller uddannelsesforløb. Hvordan kan det indgå i lovgrundlaget, når unge jo netop ikke kan vælge eksempelvis at gå produktionsskole, men skal visiteres til det? LINEBREAK ","59"
"17:58","Henrik Dahl (LA):","Altså, der har jeg bare forstået det sådan, at selv om det er rigtigt, at der finder en visitation sted, har den unge også en eller anden form for indflydelse på det og kan sige ja og nej, og dermed kan man jo ikke udelukke, at det også spiller en rolle. Man bliver jo ikke tvunget ind. LINEBREAK ","57"
"18:46","Henrik Dahl (LA):","Der er jo allerede blevet sagt mange ting for at prise L 89, og dem kan jeg helt og holdent tilslutte mig. Vi støtter, at forsøgsordningen med forberedende voksenundervisning bliver gjort permanent, så tosprogede, som ikke har de nødvendige kompetencer, kan få dem i fremtiden. Og derfor bakker vi selvfølgelig også op om lovforslaget. LINEBREAK ","54"
