"13:18","Karina Adsbøl (DF):","Hvilke overvejelser gør ministeren sig i anledningen af Højesterets dom af 18. januar 2018 om, at det ikke er i strid med grundloven og Danmarks internationale forpligtelser, at personer, som er frataget den retlige handleevne efter værgemålsloven, ikke kan stemme til folketingsvalg? LINEBREAK ","42"
"13:42","Jens Henrik Thulesen Dahl (DF):","Tak for det. Hvordan vil ministeren sikre, at kandidatuddannelsen for læger ikke fyldes op af udenlandske studerende, som rejser ud af landet efter færdig uddannelse, som det fremgår af artikel bragt i Altinget den 5. december 2017: »Hver tredje lægestuderende i Odense er fra udlandet«? LINEBREAK ","45"
"13:57","Liselott Blixt (DF):","Mange tak. I TV 2 bliver der i øjeblikket sendt et program med titlen »Kan man spise sig rask?«, hvilket er en øjenåbner for mange. Vil ministeren se på, hvordan vi kan få kosten og ernæringseksperter mere i spil som behandling i stedet for medicin? LINEBREAK ","45"
"14:04","Flemming Møller Mortensen (S):","Mange tak, formand. Spørgsmålet lyder: Agter ministeren at indkalde Folketingets partier til drøftelser om, hvordan vi i fællesskab kan styrke indsatsen mod, at vores børn og unge begynder at ryge, ved at indføre en tobaksbevilling, som butikkerne kan blive frataget ved overtrædelse af gældende lovgivning, som Socialdemokratiet har foreslået? LINEBREAK ","49"
"14:12","Flemming Møller Mortensen (S):","Tak, formand. Og spørgsmålet lyder: Mener ministeren, at det udgør en tilstrækkelig styrkelse af håndhævelsen af forbuddet mod at sælge cigaretter til børn og unge under 18 år, at Sikkerhedsstyrelsen kun tilføres to nye årsværk og derudover ikke får andre værktøjer til at udføre kontrollen med end de værktøjer, som politiet har i dag, og som politiet ikke finder tilstrækkelige? LINEBREAK ","60"
"14:52","Christine Antorini (S):","Dermed må man jo også forstå, at det, finansminister Kristian Jensen lovede under kommunalvalgkampen, nemlig at staten ville være positiv over for at gå ind i det, så åbenbart var ren kommunalvalgkampsflæsk. For det er ikke noget, der får nogen betydning på nuværende tidspunkt i forhold til miljøministeren. LINEBREAK ","48"
"14:53","Daniel Toft Jakobsen (S):","Tak for det. Kan ministeren uddybe sin og regeringens position i det udmeldte salg af tv-stationen TV 2, herunder om man nu har skiftet kurs og besluttet sig for at gå efter et minoritetssalg på 49 pct. af selskabet, som det er meldt ud af regeringspartiet Venstres medieordfører, Britt Bager? LINEBREAK ","50"
"15:33","Marlene Harpsøe (DF):","Så vil jeg bare gerne spørge ministeren igen: Hvad har ministeren ellers af ideer? For ministeren henviser til en demenspris og henviser til ting, der er aftalt i finanslovsaftalen – gode ting, synes jeg, helt bestemt – men der må da være andre kreative ting, som ministeren mener der er behov for at gøre for at sikre mere faglært personale. LINEBREAK ","60"
