"10:18","Miljø- og fødevareministeren (Esben Lunde Larsen):","Tak for spørgsmålet. Der er jo ingen tvivl om, at såvel de nationale myndigheder i Miljøstyrelsen som de kommunale jo har en interesse i, at det her bliver håndhævet, som det skal, fordi vi ingen interesse har i, at vores vaskepladser medfører forurening. Og derfor bliver der selvfølgelig lavet et helt klart setup for, hvordan det skal håndhæves. LINEBREAK ","58"
"10:18","Miljø- og fødevareministeren (Esben Lunde Larsen):","Tak for det. Nu er løsningen jo ikke altid at sende flere penge, og derfor bliver det her selvfølgelig afvejet i forhold til de indsatser, der skal varetages på forskellige områder. Så der vil være den økonomi, der skal være til det. LINEBREAK ","42"
"11:04","Per Nørhave (DF):","Jamen selvfølgelig, og det var også det, jeg indledte med, nemlig at det er vi selvfølgelig enige i. For det er altafgørende, at de studerende har et godt sted at opholde sig og studere, så de kan koncentrere sig om studierne, også for måske at nedsætte studietiden. LINEBREAK ","47"
"12:44","Benny Engelbrecht (S):","Så leder det mig naturligvis hen til det spørgsmål, som jo selvfølgelig også trænger sig på, nemlig: Hvis en sådan finanslovsaftale lander, som ordføreren siger, i løbet af få timer, vil det så være en finanslovsaftale, som vil kunne leve op til det, som vi ønsker i forbindelse med beslutningsforslaget, altså at man lever op til det demografiske træk? LINEBREAK ","59"
"13:50","Benny Engelbrecht (S):","Jeg sætter meget gerne mange flere ord på – alle de ord, der overhovedet kan være nødvendige – især hvis det er sådan, at et flertal uden om regeringen pålægger regeringen at sørge for, at velfærden bliver sikret frem til år 2025, hvis ellers den nuværende regering skulle overleve så lang tid. LINEBREAK ","52"
"13:55","Benny Engelbrecht (S):","Som jeg tilkendegav i min ordførertale, er det her vores grundsynspunkt. Det er også det, vi har indskrevet i vores politiske 2025-plan. Det er klart, at det er det, som er vores basis i forhold til et arbejde, uanset om vi sidder i opposition, som vi gør nu, eller om vi skulle være så heldige at overtage regeringsmagten. LINEBREAK ","58"
