"10:19","Aleqa Hammond (NQ):","Før Socialdemokratiet kom i regering, lovede de faktisk at komme med en officiel undskyldning, men da de kom i regering, udeblev i den undskyldning, og nu har Socialdemokratiet en anden holdning. Jeg vil gerne spørge ordføreren: Hvad er det, der gør, at Socialdemokratiet i dag støtter op om en officiel undskyldning og ikke gjorde det tidligere? LINEBREAK ","56"
"10:20","Karin Gaardsted (S):","Det tror jeg faktisk godt at jeg kan stå og love her, fordi dengang vi kom med beslutningsforslaget i 2016, var det bl.a. fru Mette Frederiksen, der stod bag beslutningsforslaget, og det er jeg helt sikker på, at fru Mette Frederiksen ikke har glemt. Så jeg er sikker på, at der kommer en officiel undskyldning. LINEBREAK ","55"
"10:33","Aaja Chemnitz Larsen (IA):","Mange tak. Et afklarende spørgsmål: Mener Liberal Alliance så, at det er den rette vej at gå, at børnene, som var en del af eksperimentet i sin tid, skal prøve den her sag ved domstolene og måske anlægge en sag mod den danske stat frem for at få en officiel undskyldning her fra Folketinget? LINEBREAK ","54"
"10:38","Pernille Bendixen (DF):","Tak, formand. Ordføreren siger i sin ordførertale, at den danske stat har tvangsfjernet børn, og at man derved har krænket deres menneskerettigheder. Bare lige for at få det på plads: Vi tvangsfjerner jo også børn i dag – er det så også en krænkelse af de børns menneskerettigheder? LINEBREAK ","48"
"10:38","Roger Courage Matthisen (ALT):","I 2015 gav Red Barnet en officiel undskyldning til de 22 børn, der var en del af eksperimentet, og Red Barnet meddelte, at tvangsflytningen var en krænkelse og i strid med børnenes grundlæggende rettigheder. I dag vurderes hændelsen som værende ude af trit med både FN's børnekonvention og FN's deklaration om oprindelige folks rettigheder. LINEBREAK ","54"
"11:18","Malou Lunderød (S):","Tak, og også tak til ministeren for besvarelsen. Ministeren nævner selv, at man i forbindelse med psykiatriplanen frem mod 2025 vil se på, hvordan man hensigtsmæssigt kunne kigge på sådan en autorisation. Så jeg vil egentlig bare høre ministeren om, hvornår man regner med at have nogle konklusioner på det. LINEBREAK ","50"
